Category_Name,uniq_id,Category,meta_title,meta_keywords,meta_description
kuppadam pattu sarees,KUPP,"Default Category,Default Category/Handloom Sarees,Default Category/Handloom Sarees/Kuppadam,Default Category/Handloom Sarees/Kuppadam/Kuppadam Pattu Sarees",Kuppadam silk sarees | Kuppadam saree ,"Kuppadam Sarees, Kuppadam Pattu Sarees, Kuppadam Silk Sarees, Kuppadam Big Border Sarees,kuppadam pattu sarees with kanchi border,kuppadam pattu sarees with pochampally border, Kuppadam Handloom Sarees",Get wide-range collection of premium quality traditional handloom kuppadam saree online crafted by our Master Weavers at the best price.
kanchi lehengas,KAPL,"Default Category,Default Category/Handloom Sarees,Default Category/Handloom Sarees/Kanchi,Default Category/Handloom Sarees/Kanchi/Kanchi lehangas",Kanchipuram lehangas | Kanchi lehangas ,"kanchi lehangas, latest kanchipuram lehangas, pure kanchipuram lehangas, kanjevaram lehangas, traditional kanjeevaram lehangas",Get wide-range collection of premium quality traditional handloom kanchipuram saree online crafted by our Master Weavers at the best price.
soft silk kanchipuram sarees,KASS,"Default Category,Default Category/Handloom Sarees,Default Category/Handloom Sarees/Kanchi,Default Category/Handloom Sarees/Kanchi/soft silk kanchipuram sarees",Soft Silk Kanchipuram sarees | Kanchi soft silk handloom saree ,"soft silk sarees, latest kanchipuram sarees, pure kanchipuram sarees, kanjevaram sarees, soft silk kanjeevaram sarees",Get wide-range collection of premium quality traditional handloom soft silk kanchipuram saree online crafted by our Master Weavers at the best price.
kanchi pattu sarees,KANP,"Default Category,Default Category/Handloom Sarees,Default Category/Handloom Sarees/Kanchi,Default Category/Handloom Sarees/Kanchi/Kanchi Pattu Sarees",Kanchipuram pattu sarees |  Kanchi silk handloom saree ,"kanchi sarees, latest kanchipuram sarees, pure kanchipuram sarees, kanjevaram sarees, traditional kanjeevaram sarees",Get wide-range collection of premium quality traditional handloom kanchipuram saree online crafted by our Master Weavers at the best price.
uppada soft silk sarees,UPSF,"Default Category,Default Category/Handloom Sarees,Default Category/Handloom Sarees/Uppada,Default Category/Handloom Sarees/Uppada/Uppada Soft Silk Sarees",Uppada soft silk sarees | latest uppada soft pattu saree ,"Buy Uppada Soft Silk Sarees Online, Uppada Soft Silk Sarees, uppada pochampally silk sarees, uppada pochampally sarees, uppada plain sarees",Get wide-range collection of premium quality traditional handloom uppada sarees online crafted by our Master Weavers at the best price.
uppada pattu sarees,UPDP,"Default Category,Default Category/Handloom Sarees,Default Category/Handloom Sarees/Uppada,Default Category/Handloom Sarees/Uppada/Uppada Pattu Sarees",Uppada Pattu sarees | uppada silk saree ,"Uppada Pattu Sarees, uppada sarees, uppada sarees online, Uppada Silk Sarees,uppada kalamkari sarees,uppada jamdani sarees",Get wide-range collection of premium quality traditional handloom uppada sarees online crafted by our Master Weavers at the best price.
pochampally ikkat pure silk sarees,PIKP,"Default Category,Default Category/Handloom Sarees,Default Category/Handloom Sarees/Ikkat,Default Category/Handloom Sarees/Ikkat/Pochampally Ikkat Pure Silk Sarees",Pochampally Ikkat silk sarees | designer pochampally ikkat silk saree ,"Ikkat Silk Sarees, ikkat silk sarees, ikkat pattu sarees, Pochampally Ikkat Pure Silk Sarees,Pochampally Ikkat Sarees,",Get wide-range collection of premium quality traditional ikkat handloom saree and lehenga cloth online crafted by our Master Weavers at the best price.
ikkat lehengas,IKPL,"Default Category,Default Category/Handloom Sarees,Default Category/Handloom Sarees/Ikkat,Default Category/Handloom Sarees/Ikkat/Ikkat Lehengas",Ikkat pattu lehangas | ikkat silk lehenga cloth ,"Buy Ikkat Lehenga Material Online, ikkat lehenga online, pure ikkat lehenga, latest ikkat pattu dress material, cotton ikkat dress material, Pochampally ikkat dress material, pure ikkat silk lehenga, ikkat pattu pavadai, Pochampally lehenga",Get wide-range collection of premium quality traditional ikkat handloom saree and lehenga cloth online crafted by our Master Weavers at the best price.
gadwal pattu sarees,GDWP,"Default Category,Default Category/Handloom Sarees,Default Category/Handloom Sarees/Gadwal,Default Category/Handloom Sarees/Gadwal/Gadwal Pattu Sarees",Gadwal Silk sarees | gadwal silk saree ,"gadwal sarees online, gadwal pattu sarees, traditional gadwal sarees, silk gadwal saree, gadwal pattu sarees hyderabad",Gadwal Silk Sarees: Get a wide-range collection of premium quality traditional gadwal saree online crafted by our Master Weavers at the best price.
paithani pure silk sarees,PTNP,"Default Category,Default Category/Handloom Sarees,Default Category/Handloom Sarees/Paithani,Default Category/Handloom Sarees/Paithani/Paithani Pure Silk Sarees",Pure Paithani sarees |  latest paithani silk handloom saree ,"traditional paithani saree, designer paithani sarees, paithani sarees online, bridal paithani saree, silk paithani sarees, real paithani sarees",Paithani sarees: Get wide-range collection of premium quality traditional silk Paithani handloom sarees online crafted by our Master Weavers at the best price.
chanderi soft silk sarees,CNSS,"Default Category,Default Category/Handloom Sarees,Default Category/Handloom Sarees/Chenderi,Default Category/Handloom Sarees/Chenderi/Chanderi Soft Silk Sarees",Chenderi soft silk sarees |  soft silk chenderi sarees ,"chanderi saree online, soft silk chenderi sarees online, soft silk sarees online, designer chenderi sarees, soft pattu chenderi sarees online",Chenderi soft silk sarees: Get wide-range collection of premium quality chenderi soft silk sarees online crafted by our Master Weavers at the best price.
chenderi silk sarees,CNDP,"Default Category,Default Category/Handloom Sarees,Default Category/Handloom Sarees/Chenderi,Default Category/Handloom Sarees/Chenderi/Chenderi Silk Sarees",Chenderi sarees |  Designer silk chenderi sarees ,"chenderi saree online, silk chenderi sarees online, cotton chenderi sarees online, designer chenderi sarees, pattu chenderi sarees online",Chenderi sarees: Get wide-range collection of premium quality traditional chenderi sarees online crafted by our Master Weavers at the best price.
linen sarees,LINS,"Default Category,Default Category/Handloom Sarees,Default Category/Handloom Sarees/Linen,Default Category/Handloom Sarees/Linen/Linen Sarees",Linen Sarees |  Pure Linen Saree ,"Buy Linen Silk Sarees Online, linen sarees, pure linen sarees, khadi linen sarees online, cotton linen sarees, linen sarees online, handloom linen sarees, linen Soft Silk sarees,linen saree",Linen sarees: Get wide-range collection of premium quality cotton & silk Linen Saree online crafted by our Master Weavers at the best price.
kollam pattu sarees,KOLP,"Default Category,Default Category/Handloom Sarees,Default Category/Handloom Sarees/Kollam Pattu,Default Category/Handloom Sarees/Kollam Pattu/Kollam Pattu Sarees",Kollam Silk Sarees | kollam pattu Saree ,"kollam pattu saree, kollam sarees, kollam silk sarees, traditional kollam sarees",Kollam Pattu Sarees: Get wide-range of premium quality  kollam Saree online crafted by our Master Weavers at the best price.
tripura silk sarees,TRPP,"Default Category,Default Category/Handloom Sarees,Default Category/Handloom Sarees/Tripura Silk,Default Category/Handloom Sarees/Tripura Silk/Tripura Silk Sarees",Tripura Silk Saree | Tripura Silk Saree ,"Tripura Silk Sarees, Tripura Silk Sarees Online Shopping, Tripura Handloom Sarees, Tripura Silk Sarees Online, tripura silk saree, tripura silk saree online",Tripura Silk Saree: Get wide-range collection of premium quality traditional Silk Saree online crafted by our Master Weavers at the best price.
organza sarees,ORGS,"Default Category,Default Category/Handloom Sarees,Default Category/Handloom Sarees/Organza,Default Category/Handloom Sarees/Organza/Organza Sarees",Organza Saree |  latest cotton & silk Organza Saree ,"Buy Organza Silk Sarees Online, Organza Pattu Sarees, Organza Silk Saree With Kanchi Border, Organza Silk Saree, Organza Silk Saree Online, Organza Saree Online",Organza Saree: Get wide-range collection of cotton & silk Organza Saree online crafted by our Master Weavers at the best price.
banarasi sarees,BANS,"Default Category,Default Category/Handloom Sarees,Default Category/Handloom Sarees/Banarasi Silk,Default Category/Handloom Sarees/Banarasi Silk/Banarasi Sarees",Banarasi Saree |  latest cotton & Banarasi pure Silk Saree ,"banarasi saree, banarasi saree silk, pure silk banarasi saree, latest banarasi sarees, indian banarasi sarees",Banarasi Silk Saree: Get wide-range collection of cotton & Banarasi Saree online crafted by our Master Weavers at the best price.
chiffon sarees,CHIF,"Default Category,Default Category/Handloom Sarees,Default Category/Handloom Sarees/Chiffon,Default Category/Handloom Sarees/Chiffon/Chiffon Sarees",Chiffon Saree | latest Chiffon Saree ,"Chiffon Saree Design, Pure Chiffon Saree Online, Light Weight Chiffon Silk Sarees, Chiffon Silk sarees, latest Chiffon Silk sarees, pure Chiffon sarees, Chiffon sarees online",Chiffon Sarees: Get wide-range collection of  latest Chiffon Sarees crafted by our Master Weavers at the best price.
kora sarees,KORS,"Default Category,Default Category/Handloom Sarees,Default Category/Handloom Sarees/Kora,Default Category/Handloom Sarees/Kora/Kora Sarees",Kora Saree |  latest pure Kora Saree ,"kora sarees, kanchi kora sarees, kora sarees online, pure kanchi kora sarees, kora pattu sarees",Kora Sarees: Get wide-range collection of  Traditional Kanchi Kora Sarees crafted by our Master Weavers at the best price.
georgette sarees,GEOS,"Default Category,Default Category/Handloom Sarees,Default Category/Handloom Sarees/Georgette,Default Category/Handloom Sarees/Georgette/Georgette Sarees",Georgette Saree | latest Georgette Saree ,"Traditional Pure Georgette Silk Saree Online, Georgette Silk Saree, Traditional Georgette Sarees, Georgette Sarees Online, Georgette saree",Georgette Sarees: Get wide-range collection of  latest Georgette Sarees crafted by our Master Weavers at the best price.
uppada cotton sarees,UPAT,"Default Category,Default Category/Handloom Sarees,Default Category/Handloom Sarees/Cotton,Default Category/Handloom Sarees/Cotton/Uppada Cotton Sarees",Uppada cotton sarees | latest uppada cotton saree ,"uppada cotton saree, Buy Cotton Sarees Online, Buy Handloom Cotton Sarees Online, Buy Online Cotton Silk Sarees, Sico Cotton Sarees, tissue cotton sarees",Get wide-range collection of premium quality traditional handloom uppada sarees online crafted by our Master Weavers at the best price.
uppada tissue sarees,UPPI,"Default Category,Default Category/Handloom Sarees,Default Category/Handloom Sarees/Cotton,Default Category/Handloom Sarees/Cotton/Uppada Tissue Sarees",Uppada tissue sarees | latest uppada tissue saree ,"uppada sarees online, latest tissue sarees, uppada tissue sarees, pure uppada tissue sarees, uppada tissue sarees in hyderabad",Get wide-range collection of premium quality traditional handloom uppada sarees online crafted by our Master Weavers at the best price.
gadwal sico sarees,GAWI,"Default Category,Default Category/Handloom Sarees,Default Category/Handloom Sarees/Cotton,Default Category/Handloom Sarees/Cotton/Gadwal Sico Sarees",Gadwal Sico sarees |  traditional silk gadwal saree ,"traditional gadwal sarees, gadwal sarees online, gadwal pattu sarees, silk gadwal saree, sico gadwal sarees, cotton gadwal sarees",Gadwal Sico Sarees: Get a wide-range collection of premium quality traditional gadwal saree online crafted by our Master Weavers at the best price.
gadwal cotton sarees,GAWT,"Default Category,Default Category/Handloom Sarees,Default Category/Handloom Sarees/Cotton,Default Category/Handloom Sarees/Cotton/Gadwal Cotton Sarees",Gadwal cotton sarees |  pure gadwal cotton saree ,"gadwal cotton sarees, Buy Cotton Sarees Online, Buy Handloom Cotton Sarees Online, Buy Online Cotton Silk Sarees, Sico Cotton Sarees, tissue cotton sarees",Gadwal Cotton Sarees: Get a wide-range collection of premium quality traditional gadwal saree online crafted by our Master Weavers at the best price.
uppada sico sarees,UPAI,"Default Category,Default Category/Handloom Sarees,Default Category/Handloom Sarees/Cotton,Default Category/Handloom Sarees/Cotton/Uppada Sico Sarees",Uppada Sico sarees | uppada sico saree ,"uppada sarees online, latest uppada sarees, uppada sico sarees, pure uppada sico sarees, uppada sico sarees in hyderabad",Get wide-range collection of premium quality traditional handloom uppada sarees online crafted by our Master Weavers at the best price.
pochampally ikkat cotton sarees,PIKT,"Default Category,Default Category/Handloom Sarees,Default Category/Handloom Sarees/Cotton,Default Category/Handloom Sarees/Cotton/Pochampally Ikkat Cotton Sarees",Pochampally Ikkat cotton sarees | designer pochampally ikkat cotton saree ,"double ikkat sarees, cotton ikkat sarees, Buy Cotton Sarees Online, Buy Handloom Cotton Sarees Online, Buy Online Cotton Silk Sarees, Sico Cotton Sarees, tissue cotton sarees",Get wide-range collection of premium quality traditional ikkat handloom saree and lehenga cloth online crafted by our Master Weavers at the best price.
ikkat cotton sarees,IKCS,"Default Category,Default Category/Handloom Sarees,Default Category/Handloom Sarees/Cotton,Default Category/Handloom Sarees/Cotton/Ikkat Cotton Sarees",Ikkat cotton sarees | designer ikkat cotton saree ,"Buy Cotton Sarees Online, Buy Handloom Cotton Sarees Online, Buy Online Cotton Silk Sarees, Sico Cotton Sarees, tissue cotton sarees, cotton ikkat saree",Get wide-range collection of premium quality traditional ikkat handloom saree and lehenga cloth online crafted by our Master Weavers at the best price.
venkatagiri pattu sarees,VAGP,"Default Category,Default Category/Handloom Sarees,Default Category/Handloom Sarees/Venkatagiri Sarees,Default Category/Handloom Sarees/Venkatagiri Sarees/Venkatagiri Pattu Sarees",Venkatagiri pattu Saree | Venkatagiri Silk Saree ,"venkatagiri sarees, venkatagiri silk saree, venkatagiri silk sarees, venkatagiri sarees online, silk venkatagiri saree",Venkatagiri Silk Saree: Get wide-range collection of Venkatagiri silk Saree online crafted by our Master Weavers at the best price.
mangalagiri pattu sarees,MAGP,"Default Category,Default Category/Handloom Sarees,Default Category/Handloom Sarees/Mangalagiri Sarees,Default Category/Handloom Sarees/Mangalagiri Sarees/Mangalagiri Pattu Sarees",Mangalagiri silk sarees | latest mangalagiri pattu saree ,"mangalagiri sarees, mangalagiri silk saree, mangalagiri silk sarees, mangalagiri sarees online, silk mangalagiri saree",Mangalagiri Silk Saree: Get wide-range collection of Mangalagiri silk Saree online crafted by our Master Weavers at the best price.
mangalagiri sico sarees,MAGI,"Default Category,Default Category/Handloom Sarees,Default Category/Handloom Sarees/Mangalagiri Sarees,Default Category/Handloom Sarees/Mangalagiri Sarees/Mangalagiri Sico Sarees",Mangalagiri Sico Saree | Mangalagiri Sico Saree ,"mangalagiri sarees, mangalagiri sico saree, mangalagiri sico sarees, mangalagiri sarees online, sico mangalagiri saree",Mangalagiri Sico Saree: Get wide-range collection of Mangalagiri silk Saree online crafted by our Master Weavers at the best price.
lichi sarees,LICH,"Default Category,Default Category/Handloom Sarees,Default Category/Handloom Sarees/Lichi,Default Category/Handloom Sarees/Lichi/Lichi Sarees",Lichi Saree | latest Lichi Saree ,"lichi sarees, lichi sarees online, pure lichi sarees online, latest lichi sarees",Lichi Sarees: Get wide-range collection of  latest Lichi Sarees crafted by our Master Weavers at the best price.
hanloom sarees,HLMS,"Default Category,Default Category/Handloom Sarees",Handloom Sarees | latest Handloom Sarees ,"handloom sarees, handloom sarees online, pure handloom sarees online, latest handloom pattu sarees",Handloom Sarees: Get wide-range collection of  latest Handloom Sarees crafted by our Master Weavers at the best price.
